{
  "dataset": "insights",
  "analytics_as_of": "2026-03-20T20:14:44.603849Z",
  "as_of": "2026-03-20T20:14:44.603849Z",
  "version": 1,
  "treasury_breakdown": {
    "assets": [
      {
        "symbol": "USDC",
        "name": "USD Coin",
        "amount": 21396.243942,
        "value_usd": 21394.703412436178
      },
      {
        "symbol": "SENDIT",
        "name": "Sendit",
        "amount": 474092937.5544444,
        "value_usd": 4574.996847400389
      },
      {
        "symbol": "WETH",
        "name": "Wrapped Ether",
        "amount": 0.02752447,
        "value_usd": 58.41710939389999
      },
      {
        "symbol": "GNARS",
        "name": "gnars",
        "amount": 562300.0,
        "value_usd": 8.74
      },
      {
        "symbol": "SKATEHACKER",
        "name": "skatehacker",
        "amount": 69400.0,
        "value_usd": 1.89
      },
      {
        "symbol": "ZIMARDRP",
        "name": "zimardrp",
        "amount": 111100.0,
        "value_usd": 1.37
      }
    ]
  },
  "spending_by_category": [
    {
      "category": "Operations",
      "totals_by_asset": [
        {
          "symbol": "TOKEN-4F6047",
          "amount": 2.06232e+20
        },
        {
          "symbol": "USDC",
          "amount": 18450.0
        },
        {
          "symbol": "ETH",
          "amount": 10.23730283
        }
      ],
      "route_count": 5,
      "proposal_count": 5
    },
    {
      "category": "Media",
      "totals_by_asset": [
        {
          "symbol": "TOKEN-09E938",
          "amount": 1575000000.0
        },
        {
          "symbol": "SENDIT",
          "amount": 283226798.0572531
        },
        {
          "symbol": "USDC",
          "amount": 89604.0
        },
        {
          "symbol": "ETH",
          "amount": 6.52409
        }
      ],
      "route_count": 37,
      "proposal_count": 32
    },
    {
      "category": "Events",
      "totals_by_asset": [
        {
          "symbol": "USDC",
          "amount": 8490.0
        },
        {
          "symbol": "ETH",
          "amount": 1.11
        }
      ],
      "route_count": 4,
      "proposal_count": 3
    },
    {
      "category": "Travel",
      "totals_by_asset": [
        {
          "symbol": "SENDIT",
          "amount": 46500000.0
        },
        {
          "symbol": "USDC",
          "amount": 21958.0
        },
        {
          "symbol": "ETH",
          "amount": 1.0
        }
      ],
      "route_count": 6,
      "proposal_count": 4
    },
    {
      "category": "Athlete Support",
      "totals_by_asset": [
        {
          "symbol": "SENDIT",
          "amount": 12881837.0
        },
        {
          "symbol": "USDC",
          "amount": 10042.0
        },
        {
          "symbol": "ETH",
          "amount": 1.0
        }
      ],
      "route_count": 4,
      "proposal_count": 3
    },
    {
      "category": "Software",
      "totals_by_asset": [
        {
          "symbol": "USDC",
          "amount": 22149.0
        },
        {
          "symbol": "ETH",
          "amount": 1.00026671
        }
      ],
      "route_count": 7,
      "proposal_count": 7
    },
    {
      "category": "Governance",
      "totals_by_asset": [
        {
          "symbol": "ETH",
          "amount": 0.4
        }
      ],
      "route_count": 2,
      "proposal_count": 1
    }
  ],
  "proposal_status_breakdown": [
    {
      "status": "active",
      "count": 2
    },
    {
      "status": "cancelled",
      "count": 16
    },
    {
      "status": "closed",
      "count": 101
    },
    {
      "status": "defeated",
      "count": 22
    },
    {
      "status": "executed",
      "count": 80
    },
    {
      "status": "succeeded",
      "count": 1
    }
  ],
  "proposal_success_by_category": [
    {
      "category": "Operations",
      "proposal_count": 15,
      "successful_count": 11,
      "success_rate_pct": 73.33
    },
    {
      "category": "Media",
      "proposal_count": 103,
      "successful_count": 77,
      "success_rate_pct": 74.76
    },
    {
      "category": "Events",
      "proposal_count": 24,
      "successful_count": 17,
      "success_rate_pct": 70.83
    },
    {
      "category": "Travel",
      "proposal_count": 27,
      "successful_count": 23,
      "success_rate_pct": 85.19
    },
    {
      "category": "Athlete Support",
      "proposal_count": 23,
      "successful_count": 17,
      "success_rate_pct": 73.91
    },
    {
      "category": "Software",
      "proposal_count": 16,
      "successful_count": 14,
      "success_rate_pct": 87.5
    },
    {
      "category": "Governance",
      "proposal_count": 7,
      "successful_count": 5,
      "success_rate_pct": 71.43
    },
    {
      "category": "Other",
      "proposal_count": 7,
      "successful_count": 6,
      "success_rate_pct": 85.71
    }
  ],
  "recipient_concentration": [
    {
      "symbol": "USDC",
      "total_amount": 170693.0,
      "top5_share_pct": 44.07,
      "top10_share_pct": 65.8,
      "top_recipients": [
        {
          "display_name": "0xe5f6...8beb",
          "slug": "0xe5f6-8beb",
          "amount": 29215.0
        },
        {
          "display_name": "0xe1b9...9641",
          "slug": "0xe1b9-9641",
          "amount": 16116.0
        },
        {
          "display_name": "0x3f51...f7f2",
          "slug": "0x3f51-f7f2",
          "amount": 12000.0
        },
        {
          "display_name": "0x7351...53f8",
          "slug": "0x7351-53f8",
          "amount": 9900.0
        },
        {
          "display_name": "0xc407...3c28",
          "slug": "0xc407-3c28",
          "amount": 8000.0
        },
        {
          "display_name": "luizhadad.eth",
          "slug": "luizhadad-eth",
          "amount": 7888.0
        },
        {
          "display_name": "0x0a7b...442e",
          "slug": "0x0a7b-442e",
          "amount": 7870.0
        },
        {
          "display_name": "0x459b...69de",
          "slug": "0x459b-69de",
          "amount": 7500.0
        },
        {
          "display_name": "0x9d4e...937f",
          "slug": "0x9d4e-937f",
          "amount": 6969.0
        },
        {
          "display_name": "overhau1.eth",
          "slug": "overhau1-eth",
          "amount": 6850.0
        }
      ]
    },
    {
      "symbol": "ETH",
      "total_amount": 21.27165954,
      "top5_share_pct": 76.9,
      "top10_share_pct": 94.94,
      "top_recipients": [
        {
          "display_name": "gami.eth",
          "slug": "gami-eth",
          "amount": 10.35730283
        },
        {
          "display_name": "0xe8b2...599d",
          "slug": "0xe8b2-599d",
          "amount": 3.0
        },
        {
          "display_name": "0x2443...5c87",
          "slug": "0x2443-5c87",
          "amount": 1.0
        },
        {
          "display_name": "0xe5f6...8beb",
          "slug": "0xe5f6-8beb",
          "amount": 1.0
        },
        {
          "display_name": "r4topunk",
          "slug": "r4topunk",
          "amount": 1.0
        },
        {
          "display_name": "rocketman21.eth",
          "slug": "rocketman21-eth",
          "amount": 1.0
        },
        {
          "display_name": "fuzzyface.eth",
          "slug": "fuzzyface-eth",
          "amount": 0.99
        },
        {
          "display_name": "0x5979...8db0",
          "slug": "0x5979-8db0",
          "amount": 0.8
        },
        {
          "display_name": "fernandoferreira.eth",
          "slug": "fernandoferreira-eth",
          "amount": 0.619
        },
        {
          "display_name": "fattybuthappy.eth",
          "slug": "fattybuthappy-eth",
          "amount": 0.43
        }
      ]
    },
    {
      "symbol": "GNARS",
      "total_amount": 0,
      "top5_share_pct": null,
      "top10_share_pct": null,
      "top_recipients": []
    }
  ],
  "workstream_performance": [
    {
      "project_id": "operations-q1-2026",
      "name": "Gnars Operations - Q1 2026 Workstream",
      "category": "Operations",
      "budget_by_asset": [
        {
          "symbol": "USDC",
          "amount": 3000.0
        },
        {
          "symbol": "ETH",
          "amount": 1.5
        }
      ],
      "spent_by_asset": [],
      "delivery_count": 2,
      "proof_count": 3,
      "proof_coverage_pct": 100.0
    },
    {
      "project_id": "docs-governance-revamp",
      "name": "Gnars Revamp: Docs and Governance",
      "category": "Governance",
      "budget_by_asset": [
        {
          "symbol": "USDC",
          "amount": 900.0
        },
        {
          "symbol": "ETH",
          "amount": 0.25
        }
      ],
      "spent_by_asset": [],
      "delivery_count": 1,
      "proof_count": 1,
      "proof_coverage_pct": 100.0
    }
  ],
  "top_recipients_over_time": [
    {
      "window_id": "7d",
      "label": "Last 7 Days",
      "since": "2026-03-13T00:00:00+00:00",
      "route_count": 1,
      "proposal_count": 1,
      "recipient_count": 1,
      "project_count": 0,
      "totals_by_asset": [
        {
          "symbol": "USDC",
          "amount": 1570.0
        }
      ],
      "top_recipients": [
        {
          "address": "0x25810d1a8b1affc444d5333bf0496f1202d6f89f",
          "display_name": "0x2581...f89f",
          "totals": [
            {
              "symbol": "USDC",
              "amount": 1570.0
            }
          ]
        }
      ],
      "top_projects": []
    },
    {
      "window_id": "30d",
      "label": "Last 30 Days",
      "since": "2026-02-18T00:00:00+00:00",
      "route_count": 1,
      "proposal_count": 1,
      "recipient_count": 1,
      "project_count": 0,
      "totals_by_asset": [
        {
          "symbol": "USDC",
          "amount": 1570.0
        }
      ],
      "top_recipients": [
        {
          "address": "0x25810d1a8b1affc444d5333bf0496f1202d6f89f",
          "display_name": "0x2581...f89f",
          "totals": [
            {
              "symbol": "USDC",